Table 4: Interpretive Groupings for Female-Leaning Coefficients (Top 50 Lemmas),
Category,Lemmas (alphabetized)
Author and Text,"Book, character, fiction, heroine, letter, novel, picture, plot, story"
Domestic and Social,"Background, child, custom, family, home, house, household, queen, social, society, widow"
Feminized Virtues,"Charming, clever, dear, feminine, friend, life, little, lovely, young"
Marriage and Courtship,"Handsome, heart, marriage, married, meet, romance"
Time,"Day, year"
Economic Class,"Labor, poor"
Other,"Come, color, know, lace, moor, real, type, vivid, want, wear, Wharton"